{"namespaces":{"ontologyIRI":[{"prefix":"crowd","value":"http://crowd.fi.uncoma.edu.ar#"}],"defaultIRIs":[{"prefix":"rdf","value":"http://www.w3.org/1999/02/22-rdf-syntax-ns#"},{"prefix":"rdfs","value":"http://www.w3.org/2000/01/rdf-schema#"},{"prefix":"xsd","value":"http://www.w3.org/2001/XMLSchema#"},{"prefix":"owl","value":"http://www.w3.org/2002/07/owl#"}],"IRIs":[]},"classes":[{"name":"http://crowd.fi.uncoma.edu.ar#Class1","attrs":[],"methods":[],"position":{"x":119,"y":153}},{"name":"http://crowd.fi.uncoma.edu.ar#Class2","attrs":[],"methods":[],"position":{"x":647,"y":143}},{"name":"http://crowd.fi.uncoma.edu.ar#Class3","attrs":[],"methods":[],"position":{"x":648,"y":390}}],"links":[{"name":"http://crowd.fi.uncoma.edu.ar#r1","classes":["http://crowd.fi.uncoma.edu.ar#Class3","http://crowd.fi.uncoma.edu.ar#Class2"],"multiplicity":["0..*","0..*"],"roles":["http://crowd.fi.uncoma.edu.ar#class3","http://crowd.fi.uncoma.edu.ar#class2"],"type":"association"},{"name":"http://crowd.fi.uncoma.edu.ar#s1","parent":"http://crowd.fi.uncoma.edu.ar#Class2","classes":["http://crowd.fi.uncoma.edu.ar#Class1"],"multiplicity":null,"roles":null,"type":"generalization","constraint":[],"position":{"x":389,"y":134.5}}],"owllink":["\n"]}
